5941e7fb9d59ce13f66966a19c505c2d ; 114 ; 24 ; 150 ; 42 ; S seems fine if we are assuming that XOR takes 10 mosfets. Apparently we can reduce this down to 6 in a very nontrivial way.        Cout could be output in a more efficient way. For one, you should try to implement logic using nand/nor, as they use less mosfets. The lab suggested the use of 3 2-input NANDs and 1 3-input NANDs, which in itself is a more efficient implementation. To implement a 3-input NAND, you can either cascade 2 2-input NANDs or hard code it using mosfets. Either way, you use 6 mosfets for the 3-input NAND
5941e7fb9d59ce13f66966a19c505c2d ; 114 ; 24 ; 96 ; 21 ; Be creative. You don't have to keep S and Cout as two separate/independent CMOS gates. Try using the output or intermediate of one as an input of another.
eeafed8bc863a264f59621ed4d3f3489 ; 114 ; 24 ; 150 ; 42 ; This advice was already given in the lab instructions: try cascading NANDS instead of ANDs and ORs.        More generically, I would tell them to try to avoid using a lot of AND and OR gates because generally there is a simpler solution. An AND gate is really a NAND followed by an inverter (similarly, an OR gate is a NOR followed by an inverter). This is why they are both 6 mosfets, they're a simpler four mosfet gate followed by a two mosfet inverter.        Thinking of improving module efficiency as reducing the number of mosfets by reducing the number of gates helped me to understand why cascading ANDs and ORs would be inefficient. Because just by looking at this drawing, it doesn't seem terribly inefficient. But if you replaced each AND and OR gate with their two gate equivalents then you can easily see how inefficient it really is.
eeafed8bc863a264f59621ed4d3f3489 ; 114 ; 24 ; 96 ; 21 ; First, I'd tell them to think about combining logic from their implementation for S and their implementation for Cout. If you're implementing a single module, FA, then it probably shouldn't be equivalent to two separate modules, S and Cout.        I would tell them to see if any of the intermediary steps in either half could be used to simplify the other. And I would probably try to lead them to simplify their Cout because their S is already very efficient, though that depends a bit on how big of a hint they want/need. (Especially because it feels intuitive to me that they should try to simplify Cout because it is longer than S, but if they were getting thrown off by that then I'd step in with more advice).        One way to lead them into it: "Think about your output after each gate. Could that output allow you to reach the output of the other half more efficiently than your current design does?" Thinking about it in terms of truth tables or the equations would probably help, depending on the student. I might try telling them to try changing their equation for Cout to include something that was already found in S, for example.
16e1443383c042600b26781268fa2e69 ; 152 ; 40 ; example=expected ; example=expected ; Consider the logic that can be replaced by less gates.
16e1443383c042600b26781268fa2e69 ; 152 ; 40 ; 96 ; 21 ; Recognize the output voltages that are repeated in the circuit. Afterwards, recognize transformations that can allow you to do the same logic with less gates and more output/input sharing.
8809bed990639fff8ad14d384c49f1cd ; 114 ; 24 ; 150 ; 42 ; Instead of using 3 AND2 gates and 2 OR2 gates, we can use 3 NAND2 gates and 1 NAND3 gate. NAND gates require less mosfets to implement, so they are useful for reducing mosfet usage. 
8809bed990639fff8ad14d384c49f1cd ; 114 ; 24 ; 96 ; 21 ; Rather than using separate gates to get S and Cout, you should share gates between the two. This is analogous to killing two bird with one stone. 
68c3b498771b9d6063fc725a4faa96ec ; 114 ; 24 ; 150 ; 42 ; Since MOS is a logically inverting technology, using inverting gates can save MOSFETS. Apply DeMorgan's law on the logical formula "AB + BCin + ACin" to turn it into "NOT(NOT(AB)NOT(BCin)NOT(ACin))," so that it is the composition of 3 NANDs with a 3-input NAND. This way we avoid implementing many unnecessary internal inverters.
68c3b498771b9d6063fc725a4faa96ec ; 114 ; 24 ; 96 ; 21 ; Once you've decided on an implementation for part of the circuit, see if there are any ways to reuse the internal signals you've already generated. Though there may be some redundancy in the formula representation, great savings may be had. For example, the desired output on Cout is "AB + BCin + ACin," but XOR(A, B)+AB (where XOR is "XOR(Q, Z) := NOT(Q)Z+QNOT(Z)") is just (A + B) + AB, so multiplying a Cin onto the XOR yields "XOR(A, B)Cin + AB" = "ACin + BCin + AB," the desired result having reused the XOR signal from earlier.
7b57df76f6e54bf5b4bf6498c29052dc ; 114 ; 24 ; 150 ; 42 ; Use DeMorgan's law to reduce Cout to natural CMOS gates
7b57df76f6e54bf5b4bf6498c29052dc ; 114 ; 24 ; 96 ; 21 ; Be efficient and use gates multiple times where possible. I actually had this logical expression for Cout but didn't think to reuse the A xor B from the S circuit.
7ab7c196d53d89cef941843b69f3d1b7 ; 114 ; 30 ; 150 ; 42 ; Try simplifying the Cout circuit by implementing 2-input and 3-input NAND gates rather than AND and OR gates. (This should also reduce the propagation time).
7ab7c196d53d89cef941843b69f3d1b7 ; 114 ; 30 ; 96 ; 21 ; Try using the XOR gates utilized for the S-output to reduce the number of MOSFETs needed for the Cout.  Specifically, look for a way to eliminate the need for your 3-input NAND gate.
1ef18e94ec8f66af684c4b9af3611ded ; 114 ; 24 ; 150 ; 42 ; There is a hint in the question which leads to better solution. Ask the student if he/she had read the hint and understood it.
1ef18e94ec8f66af684c4b9af3611ded ; 114 ; 24 ; 96 ; 21 ; Let the student observe the better solution to find out what makes it better, and learn from it.
c778228063483a5fb98cd345b1651453 ; 114 ; 30 ; 150 ; 42 ; You are using 2 2-input-OR gates to represent a 3-input-OR gate. If this was replaced with a 3 input OR gate it would would potentially increase it's speed as there is a lot of leniency with an OR gate as we can given out output as soon as know that one of the inputs is a "1". The ACin and BCin combination can also be replaced by linking the A XOR B combination with an and gate with Cin. This would further reduce the total number of mosfets.
c778228063483a5fb98cd345b1651453 ; 114 ; 30 ; 96 ; 21 ; If you look at the truth table, we can see that Cout is only "1" when there are only 2 or 3 inputs as valid "1". What is a clever way of detecting if there is only one "1" and then negate that value to produce a "1" for Cout whenever that is not the case.
6ffdb974418ac331f39c01fc396b5818 ; 66 ; 21 ; 150 ; 42 ; First of all, try to optimize your full adder. The two outputs are being computed completely independently at the moment, but it's actually possible to share gates between the two parts of the circuit if you arrange them in a clever way.        Secondly, do you actually need a full adder for the lowest bit?         Thirdly, push the limits of CMOS logic. If you stare at it for a very long time, you can find an XOR gate that uses only 9 MOSFETs. Even better, if you forget about the restriction that inputs can't directly connect to outputs, you can make an XOR out of 6 MOSFETs. Now, that isn't a valid combinational gate, so you can't chain a bunch of them together. However, as long as that XOR doesn't sit directly between inputs and outputs in your full adder, you can use as one of the XORs in the full adder -- the other gates will ensure that the full adder stays a combinational device.    
84419611fb5d8fbbd99aae3444b30aab ; 114 ; 24 ; 150 ; 42 ; The "and" and "or" gates in the Cout path can be simplified to a simpler combination of NANDS, decreasing the number of mosfets, simplifying the design, and improving run time. 
84419611fb5d8fbbd99aae3444b30aab ; 114 ; 24 ; 96 ; 21 ; This design does a beautiful job of simplifying the circuit by using the Ci as an input to both the XOR gate in the S path and the NAND gate in the Cout path, thus simplifying the Cout cascade and reducing run time since the S and Cout cascades are connected. 
96eaf74c76bc5de45e508479599c65a1 ; 114 ; 24 ; 150 ; 42 ; Each AND and OR gate implements an inverter, which takes more MOSFETs than necessary.  The advantage to using NANDs for Co is that you need not implement inverters.
96eaf74c76bc5de45e508479599c65a1 ; 114 ; 24 ; 96 ; 21 ; Try to figure out a way to preserve outputs that you used in one circuit to implement into another output.  As opposed to separating S and Cout into 2 circuits, take values from one circuit and use them in your other, and hence combining the two into one.  
d5c0df7ba64b5dcde9a9b5d7c041f207 ; 72 ; 25 ; 150 ; 42 ; //... enter your advice here        A Full Adder can be implemented much more effectively than above by using half adders (XOR for S and AND (NAND then INV) for C) or even more efficiently than that by using two "inverse carry" half adders (XOR for S and just NAND for C) and combining their "inverse" carries with a NAND gate instead of combining the two complete half adders with an OR (NOR then INV) gate. That significantly reduces the number of MOSFETs already by setting up a better full adder.        Also, the XOR gate, which is obviously essential to the half and full adder sum gate portion can be implemented with as little as 6 MOSFETs and would also significantly bring down the count.     
d9983d6a06af1c5d65779a1d3a6e78bf ; 114 ; 24 ; 150 ; 42 ; I would tell them that their solution would have passed the checkoff back in 2013, but now they need to use inverting logic because their FA isn't fast enough.
d9983d6a06af1c5d65779a1d3a6e78bf ; 114 ; 24 ; 96 ; 21 ; You can use the outputs from the XORs in your calculation for the carry bit. They don't have to be separate calculations.
0e087844b6389f8ac8f1b56185d3bfad ; 114 ; 24 ; 150 ; 42 ; Since CMOS is inverting, the ands and ors can be made faster by using nands instead. 
0e087844b6389f8ac8f1b56185d3bfad ; 114 ; 24 ; 96 ; 21 ; The two elements of the output of a full adder need not be reached separately. 
06264ae1dc36ac30c8dd345f4f7055a6 ; 126 ; 30 ; example=expected ; example=expected ; Improve your three input nand gate to make it more efficient, as it currently involves the use of an inverter
06264ae1dc36ac30c8dd345f4f7055a6 ; 126 ; 30 ; 96 ; 21 ; Consider combining the partial results of S in your Cout circuit to drastically reduce the number of mosfets
4b8255dace3ccdde0c5c87043c4f5651 ; 114 ; 24 ; 126 ; 27 ; I would show them that they are computng the XOR of A and B twice, which increases the number of mosfets. XORs take many mosfets to implement, so reusing outputs would greatly improve the circuit. Using fewer mosfets is good because it speeds up the module. This could be a very good implementation if they made that simple change.
4b8255dace3ccdde0c5c87043c4f5651 ; 114 ; 24 ; 96 ; 21 ; We know that we need to use cascading XOR gates to compute S. Instead of figuring out how to compute S and Cout independently, we can combine the logic to reduce the number of mosfets used in the module. While independently using the XOR of A and B may not lead to the best way to compute Cout on its own, it is very effective in this case because it is essentially free to use the XOR of A and B tht we will already be computing.
3d7fdd43178c9c6d7de5618d78d66300 ; 114 ; 24 ; 126 ; 27 ; Using Demorgan's law, you can simplify the circuit for Cout using three 2-input NAND gates and a single 3-input NAND gate.
3d7fdd43178c9c6d7de5618d78d66300 ; 114 ; 24 ; 96 ; 21 ; Instead of separating the circuits for S and Cout, think about how you could use parts of outputs of gates from the S and Cout sections to save gates.
82339ab0f45ef0a80cd5077875b93e78 ; 114 ; 24 ; 126 ; 27 ; Try looking at the truth table and writing out the minimum sum of products from there. Remember that negative logic gates (e.g. NAND and NOR) use fewer mosfets than positive gates (like AND or OR).
82339ab0f45ef0a80cd5077875b93e78 ; 114 ; 24 ; 96 ; 21 ; Try to implement both outputs in the same circuit. This way you can avoid duplicating gates when it's unnecessary. 
657555e116629b7a08f64843742f399c ; 114 ; 24 ; 126 ; 27 ; You can reduce the size of your Cout module by constructing it using only NAND gates, since they can be made more efficiently in CMOS. Try developing a 3-input NAND first, and then using that as part of your solution.
657555e116629b7a08f64843742f399c ; 114 ; 24 ; 96 ; 21 ; In your solution, S and Cout are calculated completely separately. Think about reducing the size of your circuit by sharing some of the logic between the two circuits -- some of it is reusable.
d77614076eb9a4352df49a3afc89f9db ; 114 ; 24 ; 126 ; 27 ; The S is fine, but Xor's are large, so if you're not going to use a tree of smaller Nands to compute the Cout bit, you should at least not compute the Xor of A and B twice! Do it one, and use the results of A Xor B for both computing the rest of S and the rest of Cout. Yay, gate-sharing! :)
d77614076eb9a4352df49a3afc89f9db ; 114 ; 24 ; 96 ; 21 ; First of all, from DeMorgan's, we know that a "Nand of Nands" is functionally equivalent to an "Or of Ands." The Cout isn't just a tree of Nands in this case. It's a smaller tree of Nands, taking advantage of the fact that the Xor of A and B was already computed by a gate in the Sum bit logic. Following the "Or of Ands" interpretation of the "Nand of Nands", Cout is high when A and B are both high (bottom most gate). When A and B are not both high, but one of them is, the Xor of A and B is high. Mentally "anding" that output of the Xor with the Cin bit gives us the other part of the Cout term. Big win: we've shared a gate (the A Xor B) to save gates.
2dc6d81ee50f706ed8bc11e8e125dfae ; 114 ; 24 ; 126 ; 27 ; Try to reduce the propagation delay by reducing the number of cascading gates.
2dc6d81ee50f706ed8bc11e8e125dfae ; 114 ; 24 ; 96 ; 21 ; Instead of recalculating values, save computation results to save time!
46b480ea7af99d74f964a55f655d7ae9 ; 114 ; 24 ; 126 ; 27 ; S looks good.     Cout can be implemented more efficiently using negative logic: Instead of using    NAND3( NAND(A,B), NAND( XOR(A,B) , Cin) )    use:    NAND3(NAND(A,B),NAND(B,C),NAND(C,A))
46b480ea7af99d74f964a55f655d7ae9 ; 114 ; 24 ; 96 ; 21 ; This is good but not great. Use the equivalence from Comparison #1 to do get Cout more efficiently.
390d19373ca1214a61556e9833e39743 ; 118 ; 25 ; example=expected ; example=expected ; Split the problem up and use the simplest gates possible. Think simple for the carry logic. Nand's and Xor's are your friend. 
390d19373ca1214a61556e9833e39743 ; 118 ; 25 ; 96 ; 21 ; This one is hard. You know that at some point, you probably would like to xor a and b. That output can be used to find the carry. Nand's and xors are your friend.
4ce341e0d11bfb7c9023975b63359180 ; 114 ; 24 ; 126 ; 27 ; Don't use an XOR2 gate to compute Cout as XOR2 requires 10 mosfets. Instead, use 3 NAND2 gates with a NAND3 gate.
4ce341e0d11bfb7c9023975b63359180 ; 114 ; 24 ; 96 ; 21 ; Achieve efficiency in your circuit by using Cin and XOR2 of A, B in both the S and the Cout circuits. By employing this method, you can use only 3 NAND2 gates to compute Cout.
26afa3673e1a2f2b107c8ef480196afd ; 114 ; 24 ; 126 ; 27 ; I would ask if they could implement the Cout circuit without an XOR gate because XOR gates use many mosfets. I'd nudge them in the direction of using DeMorgan's Laws to manipulate the Cout expression and see that it requires only 4 NAND gates.
26afa3673e1a2f2b107c8ef480196afd ; 114 ; 24 ; 96 ; 21 ; I would suggest manipulating the expressions for S and Cout to see if there are common terms, so that the two output circuits could be combined to use less mosfets.
83faef0a662381f70354e97586fb74d4 ; 114 ; 24 ; 126 ; 27 ; Consider the trade off in number of mosfets between NAND gates and XOR gates.
83faef0a662381f70354e97586fb74d4 ; 114 ; 24 ; 96 ; 21 ; Think about how you could combine upstream gates for your two outputs instead of computing each output in parallel.
a3fd125e15795159a88939ca2605486e ; 114 ; 24 ; 126 ; 27 ; Simplify Cout using Demorgan's laws to make it a NAND or NANDs as opposed to using an XOR Gate. This would reduce the total number og gates
a3fd125e15795159a88939ca2605486e ; 114 ; 24 ; 96 ; 21 ; Since the XOR of A and B is used in Cout and S there is no need to create 2 Xors instead you can feed the output of one XOR of A and B to both S and Cout.
390caed60bcdb1649315cb8637415f8e ; 114 ; 24 ; 132 ; 33 ; Note that there is a way to reduce the circuit even further (hint).
390caed60bcdb1649315cb8637415f8e ; 114 ; 24 ; 96 ; 21 ; It is possible to simplify circuits to such a degree by taking note of the sum of products and using DeMorgan's law to simplify the circuit as much as possible, thus using less mosfets.
3859af17122343483d559b82d1086e2e ; 114 ; 24 ; 132 ; 33 ; You should use three 2-input NAND gates and one 3-input NAND gate instead of an AND an an OR. In general, it is best to use NAND and NOR gates because they have two mosfets fewer than AND and OR gates.
3859af17122343483d559b82d1086e2e ; 114 ; 24 ; 96 ; 21 ; You should factor out a C from the logical expression AB + BC + CA by noticing that if A and B are not both true, then CB + CA = C XOR(B, A). This allows you to reuse one XOR gate in the FA.
41e56bd3ab12a092588bd1a9dc89fa1b ; 114 ; 30 ; 144 ; 36 ; There is some redundancy in their current setup, and there are outputs that can be used for multiple inputs, thus saving valuables mosfets. For instance, the output of the A-B Xor gate in the S set up can be reused if they changed their set up for Cout accordingly.
41e56bd3ab12a092588bd1a9dc89fa1b ; 114 ; 30 ; 96 ; 21 ; There are equivalent logic equations that require a lower number of mosfets. By looking back at the work done and finding terms that can be exchanged for their less mosfet demanding counterparts one is able to lower the needed number of mosfets for their set up.
0c04563c899047e508675f2b6d284bdb ; 114 ; 24 ; 144 ; 36 ; I would suggest that they use 3 2 input NAND gates and 1 3 input NAND gate for Cout.
0c04563c899047e508675f2b6d284bdb ; 114 ; 24 ; 96 ; 21 ; I would tell them that it is beneficial to use the XOR gate for AB for both outputs S and Cout to reduce the number of Mosfets.
3cd6d3316ee8977fa9a7cfdf503850ee ; 114 ; 24 ; 144 ; 36 ; Consider that you can use 2- and 3-input NAND gates to replace the logic of the Cout logic. NAND is simpler to implement using CMOS and uses fewer fets. A cascade of NANDs is logically equivalent to the ANDs and ORs.
3cd6d3316ee8977fa9a7cfdf503850ee ; 114 ; 24 ; 96 ; 21 ; Cout should only be 1 when all three inputs A, B, Cin are 0. Consider using some of the information produced in processing the value of S to make computing Cout simpler. How can you reduce the number of gates used in computing Cout?
810d160ffa3f7d8ccc3433b3bc88793e ; 120 ; 30 ; example=expected ; example=expected ; Try not to combine the inputs so much because you might end up requiring more inverters to create more complex systems (I manipulated the formula given for Cout and that made me use more mosfets) 
810d160ffa3f7d8ccc3433b3bc88793e ; 120 ; 30 ; 96 ; 21 ; Do not think of S and Cout as two separate circuits, try to combine them, so that the work you had to do for part of S does not have to be done again for Co
b87905d2d5aa3d69fc46e36e01610f33 ; 114 ; 24 ; 144 ; 36 ; Use karnaugh maps to get minimum sum of products. It makes the design way easier.
b87905d2d5aa3d69fc46e36e01610f33 ; 114 ; 24 ; 96 ; 21 ; Consider S and Cout as coexisting outputs that share inputs, not as 2 separate outputs with separate inputs.
29a2363fc1ab737aa94e65aec4e0c475 ; 114 ; 24 ; 144 ; 36 ; First find the minimal sum of products for Cout, then devise a circuit using only NAND's, instead of AND's and OR's. You may also try designing some custom gates so as to use even less mosfets, for example, a custom 3 input NAND gate can save 2 mosfets from a 2 NAND implementation.     
29a2363fc1ab737aa94e65aec4e0c475 ; 114 ; 24 ; 96 ; 21 ; You've implemented two separate circuits, you could try to combine them in an effort to use less mosfets, for example, A and B are being NORed on the S circuit, you could use this result and implement the Cout circuit around it.
582bb342bb4cb1cb41d18b55d9188d42 ; 114 ; 24 ; 144 ; 36 ; Reuse the common computation for Sum and Carry-Out
582bb342bb4cb1cb41d18b55d9188d42 ; 114 ; 24 ; 96 ; 21 ; Use propagate &amp; generate logic
27617d27802a9dea61e1b981f7033283 ; 126 ; 30 ; example=expected ; example=expected ; First when implementing the XOR, you can cut down on the number of mosfets by implementing 2-input NANDs. Second, an AND-OR logic gate is equivalent to an NAND-NAND gate, but it uses less mosfets due to DeMorgan's Law and they are naturally inverters.
27617d27802a9dea61e1b981f7033283 ; 126 ; 30 ; 96 ; 21 ; You can take the output of one subsection of the logic gate and use it as an input for another subsection in order not to repeat logic gates.
aa59e556ee1fea466a556cf5fa66e961 ; 126 ; 30 ; example=expected ; example=expected ; Read the hints provided by the lab. I think that I would have implemented this better had I used the hints more readily.
aa59e556ee1fea466a556cf5fa66e961 ; 126 ; 30 ; 96 ; 21 ; Attempt to tied the circuits together so that you don't have to use the same piece of a circuit more than once independently.
a44f247d49f37e6180260d863c33a41f ; 114 ; 24 ; 132 ; 36 ; I would point them to the section of the lab that advises us to use three 2-input NANDs and one 3-input NAND for the implementation of Cout.
a44f247d49f37e6180260d863c33a41f ; 114 ; 24 ; 96 ; 21 ; I would tell them to see how they can use the the output of the first XOR gate in the S implementation as an input to the gates they use for the Cout implementation to decrease the number of gates they use and thus the number of mosfets. 
d2b89cd5a50f48b8d18a684050513a82 ; 126 ; 30 ; example=expected ; example=expected ; Wait, I thought this is exactly what I did.
d2b89cd5a50f48b8d18a684050513a82 ; 126 ; 30 ; 96 ; 21 ; Think in terms of modules!
990d1ded4a2d50b5afeb24a72d645acc ; 114 ; 24 ; 132 ; 36 ; Try avoid using AND,OR. Those components require at least 2 more MOSFET than NAND,NOR would.
990d1ded4a2d50b5afeb24a72d645acc ; 114 ; 24 ; 96 ; 21 ; Try conserving the amount of times you are generating the same output. Something created in one part of the circuit can be funneled to another. 
a0069c9dc51bf8c3f266ae6dc619198f ; 114 ; 24 ; 132 ; 36 ; Your logic gates for your S output seem fine. We can work on the logic gates for Cout. We have a XOR that takes A and B inputs and gives out a O1 to say. The AND gate takes in that O1 and a C1 and outputs O2. Then we have another AND gate that takes in A and B and outputs O3. Your final XOR gate takes in that O2 and O3 to give Cout. This means my longest path is 3. We want to make our longest path shorter. What we can do is instead of having XORS and AND gates, we can implement 3 2-input NAND gates and 1 3-input NAND gate. By doing this we shorten our longest path to 2.
a0069c9dc51bf8c3f266ae6dc619198f ; 114 ; 24 ; 96 ; 21 ; Instead of thinking about components individually why not try to reuse gates. By reusing gates, we can make use less MOSFETs which means that the propagation delay will be minimal because we don't have to use the 3-input NAND gate to obtain Cout. We do that process in earlier steps using this design.
9afab6d3589a9ad65c8f91623d066a5b ; 114 ; 24 ; 132 ; 36 ; For Cout, Instead of using OR and AND gates, we can use the 3 NAND2 and 1 NAND3 gates like described in the lab. which would reduce the number of mosfets because we can use 4 mosfets for each NAND2 gate but each AND and OR requre 6. 
9afab6d3589a9ad65c8f91623d066a5b ; 114 ; 24 ; 96 ; 21 ; Instead of separately doing S and Cout, consider taking one of the outputs already computed and combining, to decrease the number of mosfets. Here, for instance, we can use the output from A XOR B in the NAND gate with Cin. This reduces the number of mosfets we need by making use more effectively of gates we're already using. 
30f11517f7256d7fb9a150981f8021f3 ; 114 ; 24 ; 132 ; 36 ; I would advise to think of a way to have one set up instead of two, so that S and Cout can be found together.
30f11517f7256d7fb9a150981f8021f3 ; 114 ; 24 ; 96 ; 21 ; I would advise the design to be changed so that there are more negative gates, which would allow there to be fewer MOSFETs used.
818947bc0fdb03e3998b5811af07ad48 ; 126 ; 30 ; example=expected ; example=expected ; Use more basic elements (pfats and nfats) and fewer logic gates. Try to use as few mosfets as possible.
818947bc0fdb03e3998b5811af07ad48 ; 126 ; 30 ; 96 ; 21 ; Reuse the results that you have already calculated instead of calculating them again.
481ed88ee2fdca042597af902d45ad2d ; 114 ; 24 ; 150 ; 42 ; In stead of using AND and OR gates for Cout - you can use NAND gates to create the same logic with less mosfets.
481ed88ee2fdca042597af902d45ad2d ; 114 ; 24 ; 96 ; 21 ; You can reduce the number of gates, but using the results of the first A/B XOR gates and feeding that into a NAND gate, thereby reducing by one 3 input NAND gate. 
0a16bc32f55683128983f223de242942 ; 114 ; 24 ; 150 ; 42 ; Cascaded and and or gates are equivalent to nand gates (in this case, three 2-input nand gates and one 3-input nand gate).
0a16bc32f55683128983f223de242942 ; 114 ; 24 ; 96 ; 21 ; S and Cin don't need to be calculated separately - they can share some gates. Specifically, since calculating S requires 2 XOR gates, the output of the first one can be used to simplify the calculation of Cout.        Cout = [A nand B] nand [Cin nand (A XOR B)]
