fa9f9233f429644023a92acabafb77c0 ; 114 ; 24 ; 150 ; 42 ; Use DeMorgan's law to take advantage of NANDs and NORs, as these take fewer MOSFETs in CMOS.
fa9f9233f429644023a92acabafb77c0 ; 114 ; 24 ; 96 ; 21 ; Be clever! You can re-use outputs in places you wouldn't expect.
8cc6d2a93758f98e50bfa268da4fa6c0 ; 114 ; 24 ; 132 ; 33 ; The lab suggests computing Cout using 3 NAND2 gates and 1 NAND3 gate. Attempt to use this pattern to reduce the number of FETs used to computer Cout. A NAND gate would replace the existing AND gate (with inputs B and Cin). This would replace the OR gate (inverted NOR requires more FETs!) and the NAND2 gate with a since NAND3.        Recall that:    Cout = AB + ACin + BCin    = ~(AB) + ~(ACin) + ~(BCin)        Since we use a NAND3 gate instead of an AND3 gate, we do not need to invert the output.
8cc6d2a93758f98e50bfa268da4fa6c0 ; 114 ; 24 ; 96 ; 21 ; I would hint that there is overlap in calculating Cout and S.        Once the provided Cin equation is assessed, it is clear that -- other than AB -- either A or B must be true when Cin is true to yield Cout. This essentially translates into Cin * A XOR B.
644b13b08a995295040191c4f21e2f74 ; 114 ; 24 ; 132 ; 33 ; I would suggest using a nand2 for b and cin and changing the last or gate into a nand3 gate.  This produces the same logic table but uses gates that require less mosfets.  
644b13b08a995295040191c4f21e2f74 ; 114 ; 24 ; 96 ; 21 ; Use the output of a xor b for one of the nand2 gates.  This eliminates the need to create the nand gates for a nand cin as well as b nand cin.  
4aa6a3bba08bf9f7c6e63c5eecbbaeb5 ; 96 ; 21 ; 132 ; 33 ; Think about reusing computed values (e.g. A ^ B). Reusing values reduces the number of components needed (but may increase propagation delay).        Think about manipulating gates in sequence to convert them to NANDs and NORs (which use less gates than ANDs or ORs, because CMOS is good for implementing inverting logic). DeMorgan's Laws can be used to do this. For example, something like (~A OR ~B) could be implemented as ~(A NAND B), which requires fewer gates.        In general, the problem of finding an optimal gate configuration is hard, but the two techniques mentioned above can be a useful guide.
eec2331c5412314329017b2d2ba39c92 ; 114 ; 24 ; 132 ; 33 ; Mutate the boolean function for Cout such that all OR and AND operations are being NOT'ed. This allows you to design a circuit using only naturally inverting CMOS gates.
eec2331c5412314329017b2d2ba39c92 ; 114 ; 24 ; 96 ; 21 ; I would ask: is there a way for you to use some intermediate node in one circuit to bypass a CMOS gate in the other, leading to a reduction of used mosfets?
0a2eccf80ad7ef5df7c61c37a1b43132 ; 114 ; 24 ; 132 ; 33 ; Consider a more efficient way of implementing your carry operation.
0a2eccf80ad7ef5df7c61c37a1b43132 ; 114 ; 24 ; 96 ; 21 ; Instead of considering standard gates, think of specific transistor solutions for calculating the carry and sum bits.
716d75cc57fd3e3de7ac3104361b2914 ; 114 ; 24 ; 132 ; 33 ; I would advise them to use three 2-input NANDs and one 3-input NAND, configured in Sum-of-Products to detect the cases where the carry-out should be nonzero.
716d75cc57fd3e3de7ac3104361b2914 ; 114 ; 24 ; 96 ; 21 ; Use intermediate steps from the cascaded XOR gates.
9d3567b78def8924c263e9d8ed31d758 ; 114 ; 24 ; 132 ; 33 ; Use demorgans law and think about cascading 2input nands with a 3input nand. It is more efficient to use only inverting logic. 
9d3567b78def8924c263e9d8ed31d758 ; 114 ; 24 ; 96 ; 21 ; Think of the logic overlap between S and Cout and share the gates between them.    Think of how to use the XORs you already have to use for S in constructing Cout
6de7799ecd47ece1dfaadd8ff938f14c ; 96 ; 18 ; 132 ; 33 ; Looking at the logic of the cout, it should be pretty obvious that the logic is the opposite of inverting. Ergo, adding an inverter (a small investment) can flip it so that the outputs are in fact inverting, and the logic can all be done with just one gate. This decreases both the time for this logic (shortest path now shorter) and the number of MOSFETs needed since more efficiently done.
c39d2e7b1b54d3e189691b8ca901322d ; 114 ; 24 ; 132 ; 33 ; Instead of having B AND Cin, you could also make it a NAND. Then, you can have a three-input NAND to combine them instead of the 2-input NAND and the 2-input OR (remember that by Demorgan's Law two cascaded NANDs are logically equivalent to a cascade of AND/OR).
c39d2e7b1b54d3e189691b8ca901322d ; 114 ; 24 ; 96 ; 21 ; Try to combine your circuit - you can use some of the gates in the S output as part of your Cout output (common elements = less gates overall!)
83225ad3552e2f8fee8b920850651d1e ; 114 ; 24 ; 132 ; 33 ; I would give the advice that CMOS gates are naturally inverting, and therefore when implementing larger logic functions, the more one can use inverting sub-logic (such as NOR and NAND gates), the less mosfets the design will end up needing.  For example, the Cout schema shown above uses an AND and an OR gate in series, both of which take more mosfets to make than their counterparts NAND and NOR because they require inverters.  I would suggest observing the cascading of NAND gates and see how that accomplishes nearly the same logic as cascading AND/OR, while using less mosfets.  If further guidance is needed, I would also suggest using a 3-input NAND gate where the inputs are the outputs of three 2-input NAND gates.  To explain this, I would use Demorgan's Law to show how a 3-input NAND gate can be used to compute the OR of 3 inversed inputs.
83225ad3552e2f8fee8b920850651d1e ; 114 ; 24 ; 96 ; 21 ; I would have the student look at their solution and observe that S and Cout are being implemented separately.  I would then tell them that there are likely simplifications that can be found by looking at intermediary computations in each of the schemas and seeing how they can be applied to the other.  In this case, we see that after the first XOR of the S schema, the result can be put through cascading NANDs to achieve the same output.  Using Demorgan's Law again, I would work backwards and show how the output we want can be achieved from a various combinations of inputs.  One of these combinations would correspond to something quite close to the above solution, and I would give the final hint that a 2-input XOR gate only differs from a 2-input OR gate when the inputs are both 1's.  This allows for a bit of simplification since we have already computed XOR, but I would note that this is a tricky design to figure out.
83eceded93349c3b88b411687dc4896c ; 114 ; 24 ; 132 ; 33 ; For Cout, rather than combining NAND(AB) and NAND(AC) into another two-input NAND, you could just take the NAND3 of NAND(AB), NAND(AC), and NAND(BC), which would use far fewer mosfets as you wouldn't need the inverters necessary for OR and AND.
83eceded93349c3b88b411687dc4896c ; 114 ; 24 ; 96 ; 21 ; Rather than making the S and Cout as two separate modules, you could use the work you've already done to get an XOR of A and B to then not need to use three full NAND2 and a NAND3 circuit. By avoiding modularization of separate outputs you can save a lot of unnecessary repetition of logic.
7a183418841e4e34554b127c38a258eb ; 72 ; 22 ; 132 ; 33 ; Implement XOR gate using transmission-gate-logic for S. Implement complex ('lump') gate with mosfet-sharing and output inverter for Cout.
0a6274500b7f16cf1e9950dd0d3015f2 ; 126 ; 30 ; example=expected ; example=expected ; Since the gate-level design matches mine, I would say to be more careful about your sub-circuit design.  I know that I used 2 more mosfets than necessary in the xor implementation, and therefore must also have used 2 more mosfets than necessary in nand.
0a6274500b7f16cf1e9950dd0d3015f2 ; 126 ; 30 ; 96 ; 21 ; If you work through the truth table of two parallel nands with a common input and an xor of the different inputs cascaded into a nands with the common input, you find them to be identical.  This makes the previous design and this one identical.
6d24f715fca44ce35bb550922d18c953 ; 96 ; 21 ; 132 ; 33 ; I would say that the two outputs do not need to have completely separate sets of combinational logic gates. It is more efficient if you look for ways they can overlap so that you don't have to calculate the same thing multiple times.
a93ed42befb01026353ec6531129d842 ; 132 ; 36 ; example=expected ; example=expected ; Do not try to be too clever with C_out--design your schematic as the expression is written. This way you will achieve the schematic shown in Comparison #1.
a93ed42befb01026353ec6531129d842 ; 132 ; 36 ; 96 ; 21 ; Keep in mind that although expressions like XOR and OR are not equivalent in isolation, when combined in a larger expression, they may serve the same purpose. Because you've already found the XOR of A and B for example, you can then use that as the OR of A and B when you know A AND B will be ANDed with A XOR B later on.
490c4360225293a8c3cd0d1982599d92 ; 92 ; 20 ; 132 ; 33 ; Try to write a SOP for Cout and use DeMorgan's. You did it correctly for the AB and ACin part. Try to use the same reasoning for BCin part too. It will require just slight changes are you are good to go. Remember how many fets are required for every gate and that the CMOS logic is inherently inverting.
6b2c495eb23b252cd430adb4c47a31df ; 114 ; 24 ; 132 ; 33 ; We can get away with using a smaller circuit to compute Cout. To find an alternative implementation, apply DeMorgan's law to the expression of complement of the complement of Cout. The specific case that turns out to be useful elsewhere too is that or of and-s is equivalent to nand of nand-s.
6b2c495eb23b252cd430adb4c47a31df ; 114 ; 24 ; 96 ; 21 ; Let's try rewriting Cout using the xor of two inputs that we already compute -- maybe we can utilize that to save circuit space. Observe that Cout is only 0 in these cases:    - A=0, B=0    - A=1, B=0, C=0    - A=0, B=1, C=0    Does any part of this table look like something we have already computed? How many mosfets would computing the rest take, and how many would we need to get to Cout from there?
aaf6eeee00bdf5a7675f3549a67d5b02 ; 114 ; 30 ; 132 ; 33 ; Focus on simplifying your model. There are many simple equivalents that can substituted in the circuit. Try using more universal gates and combining it with your XOR. 
aaf6eeee00bdf5a7675f3549a67d5b02 ; 114 ; 30 ; 96 ; 21 ; Try to remove unnecessary components of the circuit. Use your engineering mind and try to remove needless parts that are equivalent. Replace the And gates with NAND gates and try to use substitute the NOR Gate with NAND implementations. 
ef68581e3c9d574a39f6f467d26a3e50 ; 114 ; 24 ; 132 ; 33 ; Use Demorgan's Law to simplify.
ef68581e3c9d574a39f6f467d26a3e50 ; 114 ; 24 ; 96 ; 21 ; Don't calculate the same thing twice. If one part of your circuit gives you information that can be used elsewhere, take advantage of it.
3a0135f9157447e16da5c17863f1531c ; 114 ; 24 ; 132 ; 33 ; Recall that it should take 4 mosfets to make a 2-input NAND gate, and 6 for 2-input OR and 2-input AND gates.        Also, realize that DeMorgan's Law applies regardless of the number of inputs, and just as you implemented the first two AND-ORs with NAND gates, you can also implement all three with a three-input NAND gate, which takes 6 mosfets to implement, saving you 6 of them per FA module.
3a0135f9157447e16da5c17863f1531c ; 114 ; 24 ; 96 ; 21 ; Consider combining your circuits to compute S and Cout.        You can simplify your circuit for Cout if you consider A XOR B as a "free" computation since you compute it for S anyway. You can simply NAND (A XOR B) with Cin to replace ACin + BCin. Though they aren't exactly the same, because you NAND that with A NAND B, your overall circuit still takes into account the fact that you want it to return 1 when both A and B are 1 as well.
6b0f707e959cfb7a8d6c50793039cb9e ; 150 ; 36 ; example=expected ; example=expected ; Reduce the number of MOSFETs in your XOR implementation (instead of using 4 NANDs like I did).
6b0f707e959cfb7a8d6c50793039cb9e ; 150 ; 36 ; 96 ; 21 ; Take advantage of the intermediate outputs from the output process of S and implement that into the Cout process -- a 3-input NAND gate is not necessary.
b736c4acdd55a8f7626ac2e370aaabdf ; 114 ; 24 ; 132 ; 33 ; For one, avoid using ORs and ANDs when you can use NANDS and NORs.     It requires using inverters which may not always be necessary.     Also look for ways of combining NANDs and NORs because you can often reduce     the number of mosfets by combining several ORs and ANDs into a few NORs and NANDs.
b736c4acdd55a8f7626ac2e370aaabdf ; 114 ; 24 ; 96 ; 21 ; Look at the logic table, and from the minimal sum equations look for patterns that can take advantage of signals generated by other parts of your logic, in order to remove unnecessary logic used to create that signal.
019399af6748b14edf24bb4c63520095 ; 114 ; 24 ; 132 ; 33 ; You have implemented S with 2 XOR gates. That's good!         However, for Cout, you can reduce the number of MOSFETS you use by using exclusively NAND2 and NAND3 gates, since they use fewer mosfets than AND and OR gates. To do this, use DeMorgan's law and see that A*B + A*C + B*C can be rewritten to not(not(A*B) * not(A*C) * not(B*C)) !!
019399af6748b14edf24bb4c63520095 ; 114 ; 24 ; 96 ; 21 ; You do not have to treat S and Cout as completely independent processes! Try to re-use some of the MOSFETS you have used in calculating S to get Cout.        A*B + A*C + B*C can be rewritten to not(not(A*B) * not(A*C) * not(B*C)).        Now, we notice that not(A*C) * not(B*C) can be re-written as not((A (+) B)*C). This is hard to get by DeMorgan's law but we can think about it intuitively. In the first expression, if A-&gt;0 and B-&gt;0, or if A-&gt;1 and B-&gt;1 then we want to get 1 no matter what C is. However, if A-&gt;0 and C-&gt;0, then B must not be 0 in order to get 1. Similarly, if B-&gt;0 and C-&gt;0, A cannot be 0. This is basically equivalent to using an XOR. Once we realize this, it is easy to see how to re-write the expression.
c840b7b9beff727cbe36ed8e3f04ea51 ; 114 ; 24 ; 132 ; 33 ; Convert the cascaded AND/OR into cascaded NANDS
c840b7b9beff727cbe36ed8e3f04ea51 ; 114 ; 24 ; 96 ; 21 ; Don't calculate S and Cout completely separately. Use intermediate steps in S to calculate Cout.
34b25b45d8783b8eb96563a87f2ed99e ; 114 ; 24 ; 132 ; 33 ; Try implementing a 3-input NAND; it may save you some mosfets
34b25b45d8783b8eb96563a87f2ed99e ; 114 ; 24 ; 96 ; 21 ; Think about what calculations are common between the two outputs; maybe you could save some mosfets by centralizing those
4e430e7479201f968997f52393a385a8 ; 114 ; 24 ; 132 ; 33 ; I would tell them that they should try to optimize the times they use gates that can be implemented with only one CMOS gate, such as NAND and NOR. In their computation of Cout, they use an AND and an OR, and they can use demorgan's law to instead simplify this to NANDs and NORs, so they use less gates, and then less mosfets.
4e430e7479201f968997f52393a385a8 ; 114 ; 24 ; 96 ; 21 ; Instead of thinking of S and Cout as have completely separate gates, they could use internal outputs from S in Cout to make calculating parts of Cout easier.
dd0ee4aa584f539800e1443fdf250d38 ; 114 ; 24 ; 132 ; 33 ; I'd tell the student that he put NAND(A,B) and NAND(A, Cin) into a NAND gate to get OR(AND(A,B), AND(A, Cin)), and then had to stick that into an OR gate with AND(B, Cin), which is bad because not only are you using an extra two gates, but they both can't be implemented with a single CMOS gate so you'd need to add inverters. I'd hint at using a 3-input NAND gate.
dd0ee4aa584f539800e1443fdf250d38 ; 114 ; 24 ; 96 ; 21 ; I'd say that it's possible to reuse some of the results from the XOR gates in calculating Cout, and tell the student to think about what happens if you put XOR(A, B) as one input in a NAND gate.
066d19110cf76f222ad425dc9c1dc85e ; 114 ; 24 ; 132 ; 33 ; Use a 3-input Nand to reduce the number of gates needed.
066d19110cf76f222ad425dc9c1dc85e ; 114 ; 24 ; 96 ; 21 ; Use the hints provided by the lab, but try to improve on them.
e9cd056e4e5a6f0ac610fb3119fb7458 ; 114 ; 24 ; 132 ; 33 ; I think first I'd ask to make sure they knew what a NAND3 was, because I think a solution like this might come from not totally understanding how it works. After going over that, I'd talk with them about how the last NAND and NOR worked together, and ask whether a NAND3 would also work. Maybe with a lot of paper and some tables.
e9cd056e4e5a6f0ac610fb3119fb7458 ; 114 ; 24 ; 96 ; 21 ; Show them the piece that makes S and the piece that makes Cout and talk about how you could use nodes from S to get Cout, probably with more tables, since at least I really appreciate the visual aid.
3333b20bc8d5938ce956a57191e6dae7 ; 114 ; 24 ; 144 ; 36 ; Use negative logic (aka NAND and NOR) instead of AND and OR, because CMOS logic is naturally inverting. Since an AND gate is a NAND with an inverter and an OR gate is a NOR gate with a inverter, using NAND and NOR will reduce the number of mosfets used.
3333b20bc8d5938ce956a57191e6dae7 ; 114 ; 24 ; 96 ; 21 ; Note that in the process of calculating S, the XOR of A and B was already computed. Instead of building the Cout circuit completely separate from the S circuit, we can take advantage of the computations done in calculating S to make calculating Cout easier.
7bdc7019379bb29e6a623bf2087440a1 ; 126 ; 30 ; example=expected ; example=expected ; Directly inverting methods tend to be more efficient in CMOS implementations. Perhaps you should try to change the Cout portion of your full adder to use solely NAND gates?
7bdc7019379bb29e6a623bf2087440a1 ; 126 ; 30 ; 96 ; 21 ; Do you think you can combine the logic for S and the logic for Cout to get a more efficient solution? Consider how the first three NAND gates combine.
74d870f4de0a3f0721bf8bafe862c7d0 ; 114 ; 24 ; 144 ; 36 ; If you find the sum-of-products expression for Cout from the truth table, you get:    Cout = not(Ci)AB + not(A)CiB + not(B)CiA + CiAB    This simplifies to: AB + Ci(not(A)B + not(B)A) = AB + Ci*XOR(A,B), which is what the student represented. This is one way to encode Cout- however, it can be further simplified. Using a Karnaugh map, you can simplify Cout to AB + BCin + ACin. This is equal to NAND(NAND(A,B),NAND(B,C), NAND(A,C)). The first encoding has to be expressed in positive logic, and, therefore requires more mosfets. So, my advice would be to use a Karnaugh map to make sure you have completely simplified your sum-of-products expression. Additionally, express your logic function in terms of negative logic to reduce the number of mosfets.
74d870f4de0a3f0721bf8bafe862c7d0 ; 114 ; 24 ; 96 ; 21 ; Rather than thinking of your two outputs as distinct circuits, try to use the logic from one circuit to reduce the number of mosfets in another. Instead of inputting A and B into an XOR logic gate twice, as in the setup in Comparison #1, utilize the XOR gate from the first output to reduce the number of mosfets used.
d99971cd82b8a98383b5797dcf1b20f6 ; 114 ; 24 ; 144 ; 36 ; Take a look at the carry circuit and ask why you use a XOR gate, because that alone takes 10 mosfets. 
d99971cd82b8a98383b5797dcf1b20f6 ; 114 ; 24 ; 96 ; 21 ; Do your logic only once. Is there any logic that is common to both the carry and summation branches?
9cea50c5d1ccd2e4c463a965dbeb2bde ; 96 ; 21 ; 144 ; 36 ; Compare the two components of your design. Do they have any gates with inputs in common? If so, could you use this to your advantage to minimize the number of mosfets you are using by combining the two components at the site of overlap?
560e4b43d3f3b71073762bea2969fce9 ; 114 ; 24 ; 144 ; 36 ; Use a 3 input NAND to compute Cout.
560e4b43d3f3b71073762bea2969fce9 ; 114 ; 24 ; 96 ; 21 ; I should take advantage of the fact that S already computes A XOR B.
a63b3ae4f55843c31324fd182182c383 ; 126 ; 30 ; example=expected ; example=expected ; I would say to use 3 gated NAND gate to save MOSFET. 
a63b3ae4f55843c31324fd182182c383 ; 126 ; 30 ; 96 ; 21 ; Try to combine the gates used in S with Cout. 
ac94f44b7d6e929ac373183c6f475d47 ; 114 ; 24 ; 132 ; 36 ; It could be more efficient to use NANDs and NORs rather than ANDs and ORs because in CMOS, ANDs and ORs are implemented by placing an inverter onto the NAND/NOR output.
ac94f44b7d6e929ac373183c6f475d47 ; 114 ; 24 ; 96 ; 21 ; I would tell them to think outside the box and try to manipulate their current logic equation into a way that a XOR that was used previously to get the S output to be of use when getting the Cout output.
bd8b0457b979082459f19d0cff058a9c ; 114 ; 24 ; 132 ; 36 ; Use NAND2 gates and NAND3 gates instead of regular AND and OR gates. Use DeMorgan's Theorem to find this.
bd8b0457b979082459f19d0cff058a9c ; 114 ; 24 ; 96 ; 21 ; Try to combine both systems together using the same inputs.
56a52ca84890ee3f80ddb385b698ba38 ; 114 ; 27 ; 132 ; 36 ; Try using NAND and NOR gates as opposed to AND and OR gates, as they are more computationally efficient and use few MOSFETs.
56a52ca84890ee3f80ddb385b698ba38 ; 114 ; 27 ; 96 ; 21 ; Look at your computations for S and Cout. Do they share any computations in common? (e.g. A AND B). If so, can you combine these computations to one, to make the circuit more efficient? If not, can you think of a way to change your circuit logic so that the computations for S and Cout share computations in common? 
4ddbc7e5f2a67e7009ae50d58e94ecbb ; 114 ; 24 ; 132 ; 36 ; The solution translates to: Cout = (A+B)*Cin+B*Cin=A*Cin + B*Cin. It lacks term A*B. It's incorrect. 
4ddbc7e5f2a67e7009ae50d58e94ecbb ; 114 ; 24 ; 96 ; 21 ; By computing S and Cout separately, we wasted from intermediate result that can be used in both calculation of S and Cout. 
ba00176d698c22dbdf655457537de988 ; 114 ; 24 ; 132 ; 36 ; Instead of using AND and OR gates to find Cout, try to use NAND gates, because inverting gates are faster than non-inverting ones and requires less mosfets.
ba00176d698c22dbdf655457537de988 ; 114 ; 24 ; 96 ; 21 ; The implementation for S and Cout doesn't have to be completely independent modules. You used XOR gates while implementing S. Is there a way you can incorporate XOR into your logic equation for Cout so you can "reuse resources"? Try "factoring" Cin out of the given logic equation to make an XOR gate, and then using 3 NAND gates to connect to the rest of the components together.
b8912e4f7c425ce017bd33cc83937970 ; 114 ; 24 ; 132 ; 36 ; Use Boolean algebra to convert the A, B, Cin sub-circuit producing Cout into a new sub-circuit that uses only NAND gates.  The new sub-circuit uses fewer mosfets than the design shown.
b8912e4f7c425ce017bd33cc83937970 ; 114 ; 24 ; 96 ; 21 ; Try to reuse mosfets and make use of mosfets not necessarily tied to the value being computed in order to maximize efficiency.  Not every sub-circuit design necessarily requires a completely new set of mosfets.
d3bb17a1122f4c38ef31f645275039b8 ; 96 ; 18 ; 132 ; 36 ; Write out the truth table for a section of the circuit that contains multiple gates. See if you can build a circuit to spec with that table that uses fewer mosfets. You may have to look at sections with more than 2 inputs and one output.
afc426011bfcb4bf36c1640f8f4f1047 ; 114 ; 24 ; 132 ; 36 ; using a 3 input nand could help with saving both time and number of mosfets used
afc426011bfcb4bf36c1640f8f4f1047 ; 114 ; 24 ; 96 ; 21 ; using more nand gates can decrease the number of mosfets you will need to use
6a796ddf660ddf10b7323414321d2a1b ; 96 ; 21 ; 132 ; 36 ; Try combining the top and bottom parts of the design. You should be able to find a way to use certain components in the logic of S in the logic of Cout as well.
4452cdcd785a4158adcb70c91b1535f8 ; 114 ; 24 ; 150 ; 42 ; I would tell the student to consider using DeMorgans Law. I don't think that it's possible to further simplify the cascading XOR gates; however, the circuit shown below that can be simplified. From DeMorgan we know that a Nand gate is equivalent to an Or gate with inverted inputs. Therefore, we can turn the two Or gates in this circuit into Nand gates as long as we invert their inputs. For the two upper And gates we can invert their outputs (and thus invert the input of the upper Or gate) by turning them into Nand gates. We can then invert the output of this upper Or gate with an inverter. We then turn the lower And gate into a Nand gate and the final Or gate into a Nand gate and we have converted this circuit to consist solely of Nand gates and an inverter. Nand gates use 4 mosfets where as an And and Or gates use 6 mosfets - thus we have significantly reduced the number of mosfets we need to use.
4452cdcd785a4158adcb70c91b1535f8 ; 114 ; 24 ; 96 ; 21 ; I would tell them that, as I did, they probably did not consider that you can combine the portions of the circuit that calculate S and Cout. I made these two elements be calculated completely separately but it is much more efficient and intuitive to combine them.
1e5c8de295705eb3742c6b6a581cf5f8 ; 114 ; 30 ; 150 ; 42 ; Condense the two upper AND gates and the OR gate connected to them by using the equivalent output for the top XOR gate. The output of the XOR A(notB) + (notA)B is a component in the Cout output. 
1e5c8de295705eb3742c6b6a581cf5f8 ; 114 ; 30 ; 96 ; 21 ; By applying De Morgan's law to the lower half of the circuit, one can condense the OR of AND gates into the not(AND) of the two inputs.
