f2f2f47f264f7ffe875250d1fc76afea ; 114 ; 24 ; 150 ; 42 ; The cout calculation is inefficient. It would be smart to find a way to possibly combine the the or gates into one. Also, embedded in each AND and OR gate is an inverter. This is because CMOS is naturally inverting, so you should be able to use the simpler NOR or NAND gates to reduce the number of mosfets.
f2f2f47f264f7ffe875250d1fc76afea ; 114 ; 24 ; 96 ; 21 ; Consider taking the computation for the carry bit and combine it with the computation used for the S output. This can potentially make the calculation more efficient.
540617bf672b559cf8dacedd9af401c5 ; 114 ; 24 ; 150 ; 42 ; There's no reason to ignore the fact that MOSFET gates are inverting - run with it when you can, by using NAND and NOR, not AND and OR.
540617bf672b559cf8dacedd9af401c5 ; 114 ; 24 ; 96 ; 21 ; It isn't necessary to ignore the work you've done in intermediate steps, you can use every sub result you've computed, such as the XOR gate reuse at right.
8a0aec95994d0ed20ad440bce49e04c4 ; 114 ; 24 ; 126 ; 27 ; You can reuse the outputs of the A xor B to save mosfets.
8a0aec95994d0ed20ad440bce49e04c4 ; 114 ; 24 ; 96 ; 21 ; Think about reusing inputs more and think about how you can convert between logic functions to reduce the number of mosfets.
7638bbbaea0b6589a2100116a726fe6c ; 114 ; 30 ; 126 ; 27 ; Look at where you're duplicating logic. There's an easy way to reduce mosfets used. 
7638bbbaea0b6589a2100116a726fe6c ; 114 ; 30 ; 96 ; 21 ; Good work! Now make it better by perhaps drawing truth tables and looking where you have high level repeats of previously computed logic. Perhaps carry forward previous logic?
f6a91d59b97eb0683a062e15250810b0 ; 114 ; 24 ; 126 ; 27 ; Use more inverting logic! The xor takes a bazillion MOSFETs to implement; we can implement this instead using only NANDs, which take only 4 FETs each--and also a 3-input NAND which takes 6 FETs.
f6a91d59b97eb0683a062e15250810b0 ; 114 ; 24 ; 96 ; 21 ; Don't consider the outputs (S and Cout) to be "separate" entities in separate systems. By doing that, you miss out on possibilities of combining inputs and/or logic gates. In this case, we can use the output of the XOR2 (that takes input A and B and helps in the computation of S) and feed it into gates to help compute Cout.
5fc05a7ec803489fd94b256c43b239ce ; 132 ; 30 ; example=expected ; example=expected ; I would tell them to try to describe each output as a simple 2- or 3- input logic function, and build a separate circuit for each one. This is a far better approach than I originally took of creating gates made out of gates made out of gates, to the point that my original submission took longer than the allotted time.
5fc05a7ec803489fd94b256c43b239ce ; 132 ; 30 ; 96 ; 21 ; I would mention the same things I wrote in the previous questions, except in this case, I would tell them that rather than make two separate logic functions (a 2-input and a 3-input, each with one output), that they could combine the two into a single logic function with 3-inputs and 2 outputs.
133e3b26ca5cc7d7ba72bbcb437602e0 ; 114 ; 24 ; 126 ; 27 ; Use less xors and more nands
133e3b26ca5cc7d7ba72bbcb437602e0 ; 114 ; 24 ; 96 ; 21 ; feed the nands into each other instead of using 4 of them
ba46c533e060ca97d3bda49df8e9b9ba ; 114 ; 24 ; 126 ; 27 ; I would tell them to reconsider how they designed their solution for Cout, specifically the XOR logical gate in the Cout circuit. I would remind them that XOR takes a lot of mosfets to build, and ask them if they can think of more ways to use other logical gates instead of XOR.
ba46c533e060ca97d3bda49df8e9b9ba ; 114 ; 24 ; 96 ; 21 ; I would tell the them to write the logical output of each of their logical gates, and tell them to try and see if any of them matched up (or could potentially match up) with the input into a different logical gate; this way, it would be easier to see that the XOR that is involved in outputting S can be connected to the NAND2 involved in outputting Cout.
c9913b048859c45f783f8659e845ca07 ; 114 ; 24 ; 126 ; 27 ; XOR takes 10 fets, which is a lot. See if you can avoid using that XOR in your Cout circuit. Write it out as a logic equation (like A or B and B or C etc...) and try to find a way to use only NANDs.
c9913b048859c45f783f8659e845ca07 ; 114 ; 24 ; 96 ; 21 ; It's a good start to do you S circuit and then your Cout circuit, but you should try and see if there is a way to reuse gates by combining these circuits. 
57f42870c661501f90017c55deaca572 ; 114 ; 24 ; 96 ; 21 ; Think about how you can use the output from your XOR gates to help you get Cout, to eliminate some redundancy.
9fb11c0b07b64233773686fa3274e4cd ; 114 ; 27 ; 126 ; 27 ; The adder is identical. I would tell them to keep in mind that a XOR is 10 mosfets using the design given in the lab, and that there is a way to switch out that subcircuit for one that uses less mosfets, yet does not change the output of the entire circuit.        (The solution of course is to change the XOR to an OR)
9fb11c0b07b64233773686fa3274e4cd ; 114 ; 27 ; 96 ; 21 ; I would tell them to keep in mind that in the calculation of the sum, they already computed several logic functions, and that they should keep in mind that they can use those functions as inputs as part of the "separate" carry bit circuit.
129b528ce67889022ee952d939b5e9d4 ; 114 ; 24 ; 126 ; 27 ; Develop a three input NAND gate to reduce a level of cascading and to reduce the number of MOSFETs used on the MOSFET level as opposed to the gate level.
129b528ce67889022ee952d939b5e9d4 ; 114 ; 24 ; 96 ; 21 ; Try using the intermediate output of the calculations for S in calculating Cout instead of separating the two calculations to save on the number of operations required.
5a0dc00ad159824360ae0a85907bbc6e ; 96 ; 21 ; 126 ; 27 ; Computing XOR is expensive. Are there any gates that are repeating operations and can be removed?
3fc768dad95b4c0bb76a63281c8966b3 ; 150 ; 42 ; example=expected ; example=expected ; This was my design, I think that the difference lies in my gate implementation (my xor was expensive). Make sure your gates are optimized as if they are not it will cost you. 
3fc768dad95b4c0bb76a63281c8966b3 ; 150 ; 42 ; 96 ; 21 ; I wouldn't call this a better solution, as the circuit is slower. To quote the assignment, "minimize the tPD of the logic that computes Cout."        To achieve such results, I would advise looking at what transformations you can do on your boolean logic to make it contain something you have already computed.
1686f60b33f7ca2d23dceca09774ca42 ; 114 ; 24 ; 126 ; 27 ; Try to use universal gates whenever possible, a NAND gate would use less mosfets in the lower circuitry.
1686f60b33f7ca2d23dceca09774ca42 ; 114 ; 24 ; 96 ; 21 ; Think about reusing circuitry used to calculate one output to calculate the other output.
a56fff35cbfa3e9c3ef59cb2429d3699 ; 114 ; 24 ; 126 ; 27 ; Using and xor gate adds 4 mosfets per single-bit full adder. Is there any other way to implement the truth table for Cout such that we can reduce the number of mosfets used per full-adder by four mosfets.        Answer: (Using a nand3 with the inputs of three nand2s results in the proper output for Cout with a difference of four mosfets per full adder, summing to a difference of 12 mosfets. So, to set this up one must simple input the three variables into the nand2s for out1: (nand2(A,B)), out2: (nand2(A, Cin)) out3: (nand2(B, Cin)), and input the three outs into a nand3 gate.)
a56fff35cbfa3e9c3ef59cb2429d3699 ; 114 ; 24 ; 96 ; 21 ; Cout can also be implemented using xor2 gates and some nand2 gates, however if you compute Cout and S separately, this results in a larger number of mosfets than what you have here. Can you think of a way to form Cout using a xor2 gate and some nand2 gates. (Answer as in comparison #1) Alright, now can you explain how to hook this up to internal nodes in the computation of S to reduce the number of mosfets per full adder model by 6 (leading to a total reduction of 18 mosfets over the three-bit adder).
12d1427a14bf4b60224fd1a3fb7fd686 ; 114 ; 24 ; 126 ; 27 ; To decrease the number of mosfets to calculate Cout, the student can create a three-input NAND gate and take in the three two-input NAND gates. This decreases the number of mosfets used because the XOR gate uses more mosfets than a three-input NAND gate would.
12d1427a14bf4b60224fd1a3fb7fd686 ; 114 ; 24 ; 96 ; 21 ; Instead of making a three-input NAND gate, the Cout result can be created by using three two-input NAND gates with one of them taking in the inputs XOR of A and B and Cin. The output from the XOR gate used when calculating s can then be reused as an input for the NAND gate that takes in XOR of A and B and Cin. This reuse of outputs decreases the number of mosfets needed.
eefd0f0f508ef86f7a379cb8fb06fa52 ; 114 ; 24 ; 126 ; 27 ; Look at the number of MOSFETS present in a NAND2 versus a XOR2 gate.  XOR2s are much more expensive, so how could you complete the Cout calculation without using one?  If it helps, consider checking the number of MOSFETS present in a NAND3 gate.
eefd0f0f508ef86f7a379cb8fb06fa52 ; 114 ; 24 ; 96 ; 21 ; Notice that you're already computing XOR(A, B) to find their binary sum.  Since you already have that sum, how can you use that in your calculation of Cout to make it cheaper?  How would you calculate Cout only using three gates, none of which are a NAND3?
a37661d9f649290d5f621ecb171c0837 ; 90 ; 28 ; 126 ; 27 ; The Cout chain needs to be optimized, like the lab has stated. Chaining 2 of the same gate to accommodate 3 input will hurt the final schematic, just make 1 gate with 1 or more additional inputs. 
432a9b7e8ae2eb5261c8fc5320d339b8 ; 114 ; 30 ; 126 ; 27 ; You have two or more gates that accomplish the same thing. Specifically, two gates compute A nor B. Remove one of these gates to lower your mosfet count.
432a9b7e8ae2eb5261c8fc5320d339b8 ; 114 ; 30 ; 96 ; 21 ; You're probably not simplifying the logic as much as you can and using superfluous gates as a result. I used far too many inverters in my first solution, and you can cut down on your mosfet usage by trying to use less.
f85907121d219fc7e739d7a610c7e3ed ; 96 ; 18 ; 126 ; 27 ; Remember that all cmos gates can be implemented as a nand-nand circuit via sum of products. When this is not checkerboard pattern on the k-maps, this can be easily simplified into even fewer mosfets. Try to implement Cout in this way.
96d83eb58a7bf18f7ec8c5b7e9f465ec ; 114 ; 24 ; 132 ; 33 ; You can reduce the number of mosfets used by defining a 3-input NAND gate
96d83eb58a7bf18f7ec8c5b7e9f465ec ; 114 ; 24 ; 96 ; 21 ; Integrate the subcircuit for the S output with the subcircuit for Cout instead of having two separate subcircuits
9dfc87e035a1b38fa2f0276cbe6c79a7 ; 126 ; 30 ; example=expected ; example=expected ; Think about which logic gates naturally need less MOSFETS - can you make an arrangement using these low-MOSFET count logic gates that will do the same operation as your module here?    
9dfc87e035a1b38fa2f0276cbe6c79a7 ; 126 ; 30 ; 96 ; 21 ; Can the output of any of your logic gates serve as an input for another logic gate? Do S and Cout really need to be calculated separately? Can you use this to eliminate any of your current logic gates?
86bdd4b7c36e2fa49d1f2e91325c5a90 ; 114 ; 24 ; 132 ; 33 ; instead of using and AND gate and an OR gate (and thus needing an extra NAND gate to make the outputs from A NAND B and A NAND Cin positive, just use a NAND gate for B AND Cin and then you only need a NOR gate to invert the answer and get the positive solution
86bdd4b7c36e2fa49d1f2e91325c5a90 ; 114 ; 24 ; 96 ; 21 ; Instead of keeping the combinational gate for S and for Cout separate, think of a way that can combine the two together. So, instead of using 3 NAND gates for each of the three parts making up C0, think of a way of combining those 3 parts to create two so that one takes advantage of the XOR gate that is already needed to output S (see that A*Cin + B*Cin = Cin * (A + B))
51cdcf356a513a7636df8935df8e314a ; 96 ; 21 ; 132 ; 33 ; You are using two separate chains of computation, one to figure out S and another to figure out Cout. These might not look like it, but they are duplicating work. Try to figure out a way to combine them and get rid of your AND and OR gates.
a8b04808eacb0a1b1af1d50d15823d5f ; 114 ; 24 ; 132 ; 33 ; How can you condense the Logic operators for calculating Cout to use fewer mosfets? Perhaps use something that takes 3 inputs.
a8b04808eacb0a1b1af1d50d15823d5f ; 114 ; 24 ; 96 ; 21 ; Is there overlap between the diagrams for Cout and S you drew? How can you use an output from one to feed into another?
ffdaa295b51d3c542843c8e145a3a6da ; 114 ; 24 ; 132 ; 33 ; I would tell them that they should focus on using NAND gates instead of AND/OR gates. They should know the equivalence of two cascading NAND gates and how it relates to the logic equation from DeMorgan's Law. 
ffdaa295b51d3c542843c8e145a3a6da ; 114 ; 24 ; 96 ; 21 ; I would tell them to make use of the outputs of one subcircuit and incorporate it into the other. This increases the efficiency of the circuit.
be1eb5bb96c31cd19f2cbf50562031d0 ; 114 ; 24 ; 132 ; 33 ; Use a 3-input NAND gate rather than computing (A NAND B) NAND (A NAND C_in)
be1eb5bb96c31cd19f2cbf50562031d0 ; 114 ; 24 ; 96 ; 21 ; By checking truth tables, it is easy to see that NAND(A NAND B, A NAND C_i, B NAND C_in) = (A NAND B) NAND (C_in NAND (A XOR B)), and the latter is cheaper to implement in this case because we have already computed A XOR B in the upper half of the computation!
dae1a3eea8990f4e204feb2d8e5d1275 ; 114 ; 24 ; 132 ; 33 ; I would advise them to use a 3-input NAND gate with three 2-input NANDs.
dae1a3eea8990f4e204feb2d8e5d1275 ; 114 ; 24 ; 96 ; 21 ; I would advise them to consider using the intermediate outputs from the S circuit as inputs to finding Cout.
83de5046fc7337232d3a34742e4f24f0 ; 114 ; 24 ; 132 ; 33 ; Calculate Cout by using three two-input NANDs that cascade into one three-input NAND.
83de5046fc7337232d3a34742e4f24f0 ; 114 ; 24 ; 96 ; 21 ; You can use calculations for finding S to help you find Cout rather than having them be totally separate circuits. 
c9b728bbbac28cc9f74ff8cf9b4b2fae ; 104 ; 26 ; 132 ; 33 ; My design for S portion is the same.         The design for C differs. Instead of using 3 Nand gates, 1 nand gate and 1 xor, I made this part of the problem out of two Cmos Gates.         1st gate: NOT(AB + CA + CB)    2nd gate: Inverter
c9b728bbbac28cc9f74ff8cf9b4b2fae ; 104 ; 26 ; 96 ; 21 ; I used the same tactic for the S portion of the FA problem.        However, this person made use of a common XOR gate for S and Cout. I separated the two problems entirely, which yielded the extra 8 mosfets in the process. My XOR had 8 mosfets, so had I used it twice for the purpose of both - S and Cout, I would have had a more efficient design. 
e76c66091b9909d4ace15d916587705c ; 114 ; 24 ; 132 ; 33 ; ANDs and ORs are expensive in CMOS circuits -- an AND is actually an INV after a NAND and an OR is an INV after a NOR. It's also important to note that NANDs and NORs are "cheap" and that adding one more input to them simply adds two more mosfets.        This is motivation to look at whether we could use only NAND/NORs to build the Cout circuit. We note that by appyling de Morgan's law to the expression NOT(NOT(A AND B) AND NOT(A AND Cin) AND NOT(B AND Cin)), which is also NAND(NAND(A, B), NAND(A, Cin), NAND(B, Cin)), we get OR(AND(A, B), AND(A, Cin), AND(B, Cin)). So we could build Cin using just NANDs! Instead of 3 NAND2s, one AND2 and one OR2, we can have 3 NAND2s and one NAND3.        (I'm not sure how the difference is 18 mosfets though, I get that the difference is 4 mosfets... Perhaps their XOR implementation is different?).
e76c66091b9909d4ace15d916587705c ; 114 ; 24 ; 96 ; 21 ; We note that Cout = A*B + A*Cin + B*Cin can be re-written as Cout = A*B + Cin*(A + B). Then we note that this is equivalent to Cout = A * B + Cin*(A XOR B) because XOR follows OR except for the 1, 1 case, where XOR is false but OR is true. But if A = B = 1, A*B will be true and produce the correct Cout! Drawing out the truth table will help see the equivalence. This means that we can reduce the circuit further, because we've already calculated A XOR B for S so can re-use this result. Using NANDs instead of ORs/ANDs follows from de Morgan's laws, which the student already used in their circuit.
d936395bca925636399745c1b37a1b79 ; 126 ; 30 ; example=expected ; example=expected ; You can define a 3-input NAND gate instead of cascading two 2-input NAND gates.
d936395bca925636399745c1b37a1b79 ; 126 ; 30 ; 96 ; 21 ; You can simplify your solution by using three 2-input NAND gates by reusing the outputs from your XOR gates.
d0c79a262a3488589762ed5b3b75b90b ; 162 ; 34 ; example=expected ; example=expected ; At a gate level, my Full Adder circuit is identical to the solution pictured above. The advice given in the lab prompt clearly steered students in this direction.
d0c79a262a3488589762ed5b3b75b90b ; 162 ; 34 ; 96 ; 21 ; I would encourage students to find ways to reuse gate outputs for more than one computation, just as the output of A XOR B is used in the solution above.
106123eddb076a9f0a655a9ec2454176 ; 96 ; 21 ; 144 ; 36 ; One thing to do to improve the design is to replace some cascades (e.g. AND-OR) for NAND cascades. Another thing is to connect the two circuits, that way, it is possible to reuse part of the design to get both outputs, therefore reducing the overall number os mosfets.
665dc1373bffad4b7795528169b975c0 ; 114 ; 24 ; 144 ; 36 ; Try to find a more efficient way to implement Cout.  Use NANDs and NORs instead of ANDs and ORs and XORs wherever possible, since they require fewer mosfets.  
665dc1373bffad4b7795528169b975c0 ; 114 ; 24 ; 96 ; 21 ; Try to reduce redundancy in your solution by finding common patterns in S and Cout and combining them where possible.  
08ec5e7ee2d32a2c0ce49d55842619ee ; 114 ; 24 ; 144 ; 36 ; I would advise them against using NOR gates for the finding of C(out) because 10 mosfets are used in each NOR gate, and 6 for each of the AND gates. If they had used NAND gates instead, then each of the NAND gates would only use 4 mosfets and the total number of mosfets used would decrease. 
08ec5e7ee2d32a2c0ce49d55842619ee ; 114 ; 24 ; 96 ; 21 ; I would remind them that because of Demorgan's law, they could simplify their logic by replacing some of the NAND gates with NOR gates, and then that they already implemented some NOR gates whose outputs they could reuse.
e8b1eb6efd9bee20cbfab7927c436d91 ; 114 ; 24 ; 144 ; 36 ; You can use NANDs to make the Cout, one of which is a 3-input NAND which is more efficient.
e8b1eb6efd9bee20cbfab7927c436d91 ; 114 ; 24 ; 96 ; 21 ; You do not have to make the S and Cout separately. You can use the output AXORB for S in your circuitry for Cout
387332c3b8e6e59e4875d274d30cd66e ; 96 ; 21 ; 144 ; 36 ; The first thing I would suggest is to integrate the circuits for S and Cout. The XOR in the second circuit can be replaced by the leftmost XOR gate in the S circuit. We can then route this output to the AND gate. This eliminates one XOR gate (which contains quite a few mosfets). Because NAND gates are the preferred in the implementation of this adder, we can then replace the AND/OR gates as NAND gates by Demorgan's Law. 
a86760c8437849745cc669816cdf68a2 ; 114 ; 24 ; 144 ; 36 ; Consider using DeMorgan's Laws to transform the Cout logic into a set of NANDs.
a86760c8437849745cc669816cdf68a2 ; 114 ; 24 ; 96 ; 21 ; Rather than implementing the logic for S and Cout as totally distinct circuits, is there a way that you could use an intermediate output from one as an intermediate input in the other?
1036759aa975555600fa944e15d0584f ; 114 ; 30 ; 144 ; 36 ; Get rid of the bottom XOR gate and connect the inputs differently
1036759aa975555600fa944e15d0584f ; 114 ; 30 ; 96 ; 21 ; Replace the  two AND gates and OR gate with two NAND gates
d1dc87369c1aac2db87a95d16ef4dd8a ; 114 ; 24 ; 132 ; 36 ; Use inverting logic (NAND gates) for Cout
d1dc87369c1aac2db87a95d16ef4dd8a ; 114 ; 24 ; 96 ; 21 ; Combine logic for S and Cout
c6bd74c3c66a1ef39584080032126361 ; 168 ; 51 ; example=expected ; example=expected ; Use only XOR gates for your S output and only NAND gates for Cout but don't limit yourself to 2-input devices.
c6bd74c3c66a1ef39584080032126361 ; 168 ; 51 ; 96 ; 21 ; Try making one 2-output device rather than two 1-output devices.
1c99c5a7d118311c49b120be2118e44a ; 114 ; 24 ; 132 ; 36 ; Instead of using cascading AND/OR for the computation of Cout, consider using NAND. Two cascaded NANDs are logically equivalent to a cascade of AND/OR.
1c99c5a7d118311c49b120be2118e44a ; 114 ; 24 ; 96 ; 21 ; We can use the result of A xor B in order to eliminate a NAND gate in the computation of Cout.
3ea51325231bfc23fd2949f38b02d613 ; 96 ; 21 ; 132 ; 36 ; Look at the gate they're duplicating. They can combine the AND and OR into 2 cascaded NANDS and combine with the first A XOR B gate to end up with 3 NAND gates for Cout.
0138facdf58028465ea5d7ede55cbdb6 ; 90 ; 28 ; 132 ; 36 ; Try using NOR and NAND gates instead of OR and AND gates. Because CMOS gates naturally invert signals, OR and AND gates require an inverter at the end of a NAND or NOR circuit, so they have two more mosfets each. You can easily invert your logic to use NAND and NOR instead of AND and OR gates by remembering that (A) AND (B) = (NOT A) NOR (NOT B), and that (A) OR (B) = (NOT A) NAND (NOT B).
8cb1a0fd9578fda627dded85756e8702 ; 156 ; 48 ; example=expected ; example=expected ; So, one thing you didn't consider was having multiple-input Mosfets.  We know there are issues with speed when we have more mosfets, so there's no reason to cascade two adds when we can use one!  That decreases your MOSFET count by 14 Fets per Full Adder.  Realize though that XOR3 isn't as easy to implement, which is why we use the cascade for that here.
8cb1a0fd9578fda627dded85756e8702 ; 156 ; 48 ; 96 ; 21 ; This isn't quick to think of, but it makes a lot of sense.  We preserve the definition of S, and we not that AB+BC+CA is AB+(BC+CA) = AB+C(A+B).  Then we can use casework.  If A AND2 B are true, then the definition for Cout is True; otherwise, if Cout is true exactly one (XOR2) of them must be True, AND2 C must be true.        This is motivated by the desired to reuse what we have -- and the XOR representation is stuck, so if we use the low-noise margin output of the first XOR2, we may be able to avoid having to do a calculation to get a similar result.
aa9a7f5e4bcccf5ec25bea5f7e8492eb ; 114 ; 24 ; 132 ; 36 ; I would tell them to reconsider there Cout portion of their adder.  Because cmos is naturally inverting, it would be more efficient to use NORs and NANDs because your signal doesn't have to go through an inverter as well.
aa9a7f5e4bcccf5ec25bea5f7e8492eb ; 114 ; 24 ; 96 ; 21 ; I would tell them to try manipulating either the formula or the gates to try to reduce the number of gates.
2be7d7e09b2268200167ab05e219d46d ; 114 ; 24 ; 132 ; 36 ; To compute Cout, use NAND2's and a NAND3, which use far fewer mosfets than the ANDs and ORs.
2be7d7e09b2268200167ab05e219d46d ; 114 ; 24 ; 96 ; 21 ; Use the result of A XOR B to compute Cout with 3 NAND2's (instead of 3 NAND2's and a NAND3).
fd88f36c94a82467c60ba694d9c61773 ; 126 ; 30 ; example=expected ; example=expected ; My gate-level solution is the same as above, so I'd need to go through my/their gates.
fd88f36c94a82467c60ba694d9c61773 ; 126 ; 30 ; 96 ; 21 ; Use the intermediate step A XOR B from S in computing Cout by finding (A XOR B) NAND C instead of (A NAND C) NAND (B NAND C).
13f5675a9defb7a16b2e115e52191ab9 ; 114 ; 24 ; 132 ; 36 ; Simplify Cout by using inverting logic
13f5675a9defb7a16b2e115e52191ab9 ; 114 ; 24 ; 96 ; 21 ; Think about how you can reuse your gates to make things more efficient
f2bf56531d17dd7822c26b5cd8391aa4 ; 114 ; 24 ; 132 ; 36 ; Our designs to compute S are the same, but the design to tabulate Cout differs. It seems as though this student used AND and OR gates, but using NAND gates is much more efficient. By using DeMorgan's Law this circuit can be translated into the more efficient version using NAND gates.
f2bf56531d17dd7822c26b5cd8391aa4 ; 114 ; 24 ; 96 ; 21 ; I think their are alternatives to the internals of the XOR gate. These alternatives contain less than 10 MOSFETS. This would significantly decrease the number of gates from 114 to 96 mosfets.
bbccdc47e193cb291ef72abd58959e64 ; 138 ; 36 ; example=expected ; example=expected ; Good job getting the FA schematic right! Now all that is needed is to reduce the number of mosfets in the XOR gate.
bbccdc47e193cb291ef72abd58959e64 ; 138 ; 36 ; 96 ; 21 ; If any combination of inputs is used more than once, considering only calculating that combination once and using the result in future calculations. Also, reduce the XOR mosfet count.
d87178e208437cdb1c81615d3d4c9585 ; 114 ; 24 ; 132 ; 36 ; I would tell them to consider using NAND gates to calculate Cout instead of ANDs and ORs.
d87178e208437cdb1c81615d3d4c9585 ; 114 ; 24 ; 96 ; 21 ; I would tell them to try to think of a way to use fewer NAND gates by wiring XOR(A,B) (which they calculated while trying to find S) into one of the NAND gates.  Then I would tell them to see if they could think of a way to build the circuit without a three-input NAND gate.
